,text
0, Abiy Ahmed Vladimir Lenin and the Quest for Peace Abiy Ahmed was   a hurry This year s Nobel Peace Prize laureate surprised his Norwegian hosts when   declined   hold press conferences and skipped town shortly after delivering his Dec Nobel lecture Rising ethnic tensions beckoned the Ethiopian prime minister home   Abiy won the Nobel for his decisive initiative   resolve the border conflict with neighboring Eritrea but his most important work lies ahead   him Ethnic conflict   the principal threat   the stability   Ethiopia Africa s secondmostpopulous country   the world s fastestgrowing economies and a critical U S counterterrorism partner And the country s constitution exacerbates the problem   stave off disaster   Abiy must reverse decades   ethnic exclusion reinforce panEthiopian identity and reform a flawed federal system   must banish the ghost   Vladimir Lenin The Ethiopian census lists more than ethnic groups and the constitution has reinforced differences among them   dividing the country into nine ethnically defined regional states Now that   Abiy has called for elections and lifted restrictions   freedom   expression ethnonationalists among the regionally dominant groups are feeling emboldened Some are violent Minorities   the nine ethnic states have good reason   fear the tyranny   the majority: Nearly three million Ethiopians fled their homes   That s more than were internally displaced due   conflict   Syria Somalia and Nigeria combined year Ethnic federalism   a very problematic model for any multiethnic society says Lovise Aalen a political scientist   Norway s Christian Michelsen Institute The federal structure empowers regionally dominant groups like the Oromo   Ethiopia s population and the Amhara giving them little reason   compromise with ethnic minorities   migrants who   left their home region Unlike any other constitution Addis Ababa University political scientist Asnake Kefale tells   Ethiopia s allows selfdetermination     secession While the provision   unique   isn t unprecedented   appeared   the constitution   Yugoslavia Ethiopian ethnic federalism presents a historical puzzle: Why would   ethnically diverse country adopt such a constitution especially a few years after the Soviet Union and Yugoslavia fell apart?
1,Aalen says ethnic federalism was a very useful tool for the TPLF the ethnic Tigrayan rebel group that seized power   They     the population couldn t dominate efficiently through a unitary system Federalism allowed the TPLF   pit ethnic groups against another and monopolize power   the center But federalism wasn t just a sophisticated divideandrule thing   was   ideological thing   Aalen continues They were a MarxistLeninist group who were highly influenced   the Leninist thinking about ethnicity Lenin thought identities were firmly fixed not easily mobilized easily dormant     Aalen puts     held that a centralized party could through repression guide ethnic mobilization indefinitely Both assumptions proved faulty The historical puzzle gives way then   historical irony   Ethiopia MarxistLeninist rebels triumphed   the Cold War ended They brought with them   idea that had been tried   the Soviet Union and Yugoslavia All this   a country with the raw material   forge a strong national identity including a proud history   defying colonialism   Kefale sees some good   Ethiopian federalism There were some advances   says The different groups were allowed   use their languages for selfadministration and for education   October   Abiy published a book called Medemer The title synergy   Amharic evokes panEthiopian identity But   the political system opens   longdisempowered groups aren t feeling medemer   Nov voters   the Sidama zone   Ethiopia s southern region home   more than ethnicities overwhelmingly voted   create a   state The Sidama example may lead other ethnic groups   seek statehood for themselves I think there are going     more regions   the south   Kefale says     Abiy hopes     celebrated   Ethiopia for generations and not merely   Norway for a night   needs     things First immediately provide security for vulnerable minorities Second propose a constitutional convention ideas   strengthen national identity: Reconfigure the electoral system   encourage coalitions across ethnic lines and break   the existing ethnic regions into smaller provinces Before considering constitutional reforms however   Abiy have   triumph   elections scheduled for May Medemer rhetoric wins him support across ethnic lines but   has outraged some   his fellow Oromos such   Jawar Mohammed whose Oromia Media Network has more than a million Facebook followers   Abiy s defense minister   Oromo has spoken out against the prime minister s latest gamble: dissolving the old ruling party and replacing   with the new Prosperity Party There are elections there   the formation   the party   Kefale says The system   very much overwhelmed   Abiy has the Peace Prize but his work for peace has only begun Middle East News World Trump Calls for Restraint   Northwestern Syria President criticizes Russia Syria and Iran for intensifying attacks   rebel stronghold Russia Syria and Iran are killing     their way   killing thousands   innocent civilians   Idlib Province Don t    !
